{
  "schema_version": "1.1.0",
  "generated_at": "2026-07-14",
  "inventory_layers": {
    "declared_dependency_metadata": "Project purpose, constraints, approval, and expected runtime fields; declarations are not host measurements.",
    "measured_current_host_inventory": "Versions and file identities observed on the controlled host; each fresh OCR run writes a separately measured sanitized dependency inventory.",
    "package_manager_claims": "Package names, versions, architectures, and source identities reported by the local Ubuntu package database.",
    "independently_verified_hashes": "SHA-256 values computed directly over installed files. A checksum verifies bytes, not license conclusions."
  },
  "components": [
    {
      "name": "FFmpeg",
      "purpose": "Controlled fixture generation, subtitle decoding, video sampling, and keyframe extraction",
      "identifier": "ubuntu:ffmpeg",
      "version": "7:6.1.1-3ubuntu5",
      "source": "https://ffmpeg.org/ and Ubuntu package repositories",
      "checksum": "sha256:ed16af623947494a72e284b6eb8ff225f2da22b38b5d5069c2fd4b4ba3384e41",
      "license_id": "GPL-2.0-or-later",
      "license_source": "Locally installed `ffmpeg -L`; this build has --enable-gpl",
      "redistribution_constraints": "GPL source and notice obligations apply to redistribution of this configured binary.",
      "commercial_use_constraints": "No project-specific prohibition identified; GPL compliance remains required. This is not legal advice.",
      "data_use_constraints": "None imposed by the executable; source-media rights are governed separately.",
      "runtime_requirements": "Native Linux executable and compatible shared libraries",
      "network_required": false,
      "weights_status": "not_applicable",
      "approval_record": "Approved for local M0-M2A deterministic tooling only",
      "approval_date": "2026-07-13",
      "known_risks": ["Complex decoder attack surface", "Configured GPL build", "Requires resource controls for untrusted media"]
    },
    {
      "name": "ffprobe",
      "purpose": "Read-only media, stream, time-base, language, disposition, and chapter inventory",
      "identifier": "ubuntu:ffmpeg/ffprobe",
      "version": "7:6.1.1-3ubuntu5",
      "source": "https://ffmpeg.org/ and Ubuntu package repositories",
      "checksum": "sha256:272f6ebc634a63d9c8b4ca68e964119d980f25154e5aa2c35e5487da48e9a58f",
      "license_id": "GPL-2.0-or-later",
      "license_source": "Locally installed FFmpeg package license output",
      "redistribution_constraints": "GPL source and notice obligations apply to binary redistribution.",
      "commercial_use_constraints": "No project-specific prohibition identified; GPL compliance remains required. This is not legal advice.",
      "data_use_constraints": "None imposed by the executable; source-media rights are governed separately.",
      "runtime_requirements": "Native Linux executable and compatible shared libraries",
      "network_required": false,
      "weights_status": "not_applicable",
      "approval_record": "Approved for local M0-M2A deterministic tooling only",
      "approval_date": "2026-07-13",
      "known_risks": ["Parser and decoder attack surface", "Metadata output must remain bounded"]
    },
    {
      "name": "jsonschema",
      "purpose": "Draft 2020-12 artifact and contract validation",
      "identifier": "pypi:jsonschema",
      "version": "4.26.0",
      "source": "https://github.com/python-jsonschema/jsonschema",
      "checksum": null,
      "license_id": "MIT",
      "license_source": "Installed distribution: jsonschema-4.26.0.dist-info/licenses/COPYING",
      "redistribution_constraints": "Retain copyright and permission notice.",
      "commercial_use_constraints": "None stated by the MIT license.",
      "data_use_constraints": "None.",
      "runtime_requirements": "Python >=3.10 upstream; AV-Atlas core requires Python >=3.11",
      "network_required": false,
      "weights_status": "not_applicable",
      "approval_record": "Core schema dependency pinned by uv.lock",
      "approval_date": "2026-07-13",
      "known_risks": ["Transitive dependencies must remain lock-pinned and audited"]
    },
    {
      "name": "DejaVu Sans",
      "purpose": "Byte-stable project-authored fixture text rendering",
      "identifier": "ubuntu:fonts-dejavu-core/DejaVuSans.ttf",
      "version": "2.37-8",
      "source": "https://dejavu-fonts.github.io/",
      "checksum": "sha256:ae7b7855e115a5966d8b1b3f80f254ccc117ec86f9965e202ee2940453837280",
      "license_id": "LicenseRef-Bitstream-Vera",
      "license_source": "/usr/share/doc/fonts-dejavu-core/copyright",
      "redistribution_constraints": "Retain copyright/trademark/license notice; modified fonts must follow naming restrictions.",
      "commercial_use_constraints": "May be sold only as part of a larger software package, per the installed license text.",
      "data_use_constraints": "None.",
      "runtime_requirements": "Font file available at the documented Linux path",
      "network_required": false,
      "weights_status": "not_applicable",
      "approval_record": "Approved for controlled fixtures",
      "approval_date": "2026-07-13",
      "known_risks": ["Path is distribution-specific", "Different font builds can change fixture bytes"]
    },
    {
      "name": "Tesseract OCR",
      "purpose": "Approved local CPU-only frame-level text detection and recognition",
      "identifier": "ubuntu:tesseract-ocr",
      "version": "5.3.4-1build5 (amd64; source tesseract 5.3.4-1build5)",
      "source": "Locally installed Ubuntu distribution package at /usr/bin/tesseract",
      "checksum": "sha256:9f831cab7525c3dab04af41bda35182af7ea1df9dceeaaa2f3bf207ac45c06a5",
      "license_id": "Apache-2.0",
      "license_source": "/usr/share/doc/tesseract-ocr/copyright (sha256:2442a6ad56b34fc1e0ec4b13509e22d4e428c856e488b2a709456ce4e9f0ab4e)",
      "redistribution_constraints": "Apache-2.0 notice obligations and Ubuntu package notices apply.",
      "commercial_use_constraints": "No project-specific prohibition identified; not legal advice.",
      "data_use_constraints": "Source-media rights are governed separately.",
      "runtime_requirements": "Native Linux amd64 executable; Leptonica 1.82.0; CPU-only; OMP_THREAD_LIMIT=1 per process; maximum four workers",
      "network_required": false,
      "weights_status": "not_applicable",
      "approval_record": "Operator authorized the locally packaged Tesseract executable and locally installed English data for M2B only",
      "approval_date": "2026-07-14",
      "known_risks": ["Native image parser attack surface", "OpenMP oversubscription without enforced limits", "Not an OS sandbox"]
    },
    {
      "name": "libtesseract",
      "purpose": "Tesseract OCR shared runtime library",
      "identifier": "ubuntu:libtesseract5:amd64",
      "version": "5.3.4-1build5 (amd64; source tesseract 5.3.4-1build5)",
      "source": "Locally installed Ubuntu distribution package",
      "checksum": "sha256:0d3b71cd757860c6639918c1b2d9407c8652ee22babc8d5c5f18cc35dde6334b",
      "license_id": "Apache-2.0",
      "license_source": "/usr/share/doc/libtesseract5/copyright (sha256:2442a6ad56b34fc1e0ec4b13509e22d4e428c856e488b2a709456ce4e9f0ab4e)",
      "redistribution_constraints": "Apache-2.0 notice obligations and Ubuntu package notices apply.",
      "commercial_use_constraints": "No project-specific prohibition identified; not legal advice.",
      "data_use_constraints": "None beyond source-media rights governed separately.",
      "runtime_requirements": "Linux amd64 shared library /usr/lib/x86_64-linux-gnu/libtesseract.so.5.0.3",
      "network_required": false,
      "weights_status": "not_applicable",
      "approval_record": "Transitive native runtime of the operator-approved packaged executable",
      "approval_date": "2026-07-14",
      "known_risks": ["Native parser attack surface", "Shared-library compatibility is distribution-specific"]
    },
    {
      "name": "Tesseract English language data",
      "purpose": "Approved English OCR language data",
      "identifier": "ubuntu:tesseract-ocr-eng",
      "version": "1:4.1.0-2 (all; source tesseract-lang 1:4.1.0-2)",
      "source": "Locally installed Ubuntu distribution package at /usr/share/tesseract-ocr/5/tessdata/eng.traineddata",
      "checksum": "sha256:7d4322bd2a7749724879683fc3912cb542f19906c83bcc1a52132556427170b2",
      "license_id": "Apache-2.0",
      "license_source": "/usr/share/doc/tesseract-ocr-eng/copyright (sha256:33fb8161898e34fcf5c6b8585d6be97642d7e8f34a922e783c6c5c970d0b09ad)",
      "redistribution_constraints": "Apache-2.0 notice obligations and Ubuntu package notices apply.",
      "commercial_use_constraints": "No project-specific prohibition identified; not legal advice.",
      "data_use_constraints": "Language data is third-party pretrained data, not AV-Atlas-trained weights.",
      "runtime_requirements": "4,113,088-byte traineddata file and compatible approved Tesseract installation",
      "network_required": false,
      "weights_status": "present",
      "approval_record": "Operator authorized locally installed English language data for M2B",
      "approval_date": "2026-07-14",
      "known_risks": ["Third-party pretrained language data", "Synthetic accuracy does not generalize to real media"]
    },
    {
      "name": "Tesseract orientation and script detection data",
      "purpose": "Installed orientation/script data; inventoried but not used by the frozen M2B default configuration",
      "identifier": "ubuntu:tesseract-ocr-osd",
      "version": "1:4.1.0-2 (all; source tesseract-lang 1:4.1.0-2)",
      "source": "Locally installed Ubuntu distribution package at /usr/share/tesseract-ocr/5/tessdata/osd.traineddata",
      "checksum": "sha256:9cf5d576fcc47564f11265841e5ca839001e7e6f38ff7f7aacf46d15a96b00ff",
      "license_id": "Apache-2.0",